{
 "schema": "trophy.scene.v1",
 "game_id": "g_synth001",
 "sport_hint": null,
 "created_at_ms": 1750000000000,
 "duration_s": 4.852,
 "cameras": [
  {
   "cam_id": "c_syn001",
   "image_size": {
    "w": 1280,
    "h": 720
   },
   "H_img_to_field": [
    0.0011111111,
    0.0,
    -0.7111111111,
    -0.0,
    -0.0020025341,
    0.7631532316,
    -0.0,
    0.0004693439,
    0.0985622255
   ],
   "reproj_err_px": 0.0,
   "trusted": true,
   "fps": 30.0,
   "position_m": [
    0.0,
    -3.0,
    2.0
   ]
  },
  {
   "cam_id": "c_syn002",
   "image_size": {
    "w": 1280,
    "h": 720
   },
   "H_img_to_field": [
    -0.0011019754,
    0.0002469848,
    0.6115213836,
    0.0001421904,
    0.0019141321,
    -0.8175091376,
    0.0,
    0.0004192219,
    0.1025687494
   ],
   "reproj_err_px": 0.0,
   "trusted": true,
   "fps": 30.0,
   "position_m": [
    0.4,
    3.1,
    2.2
   ]
  }
 ],
 "court": {
  "template": "table_tennis",
  "score": 1.0,
  "length_m": 2.74,
  "width_m": 1.525,
  "net_x_m": 0.0,
  "candidates": [
   {
    "template": "table_tennis",
    "score": 1.0
   }
  ]
 },
 "ball": {
  "colour": "white",
  "radius_px_mean": 5.0,
  "radius_px_sd": 1.0
 },
 "people_count": 2,
 "sample_frames": [],
 "l1_log": "rally_02.l1.jsonl",
 "labels": "rally_02.labels.json",
 "synthetic": true,
 "label": "SYNTHETIC: generated by trophy-synth, not a recording"
}
